{
    "source_path": "video/xxx.mp4",
    "chronological_emotion_peaks": [
        "Peak at 2.88s: angry (slight), contempt (slight)"
    ],
    "overall_peak_frame_info": {
        "frame_number": 88,
        "timestamp": 3.48,
        "top_aus_intensities": {
            "AU06_r": 1.45,
            "AU07_r": 2.78,
            "AU10_r": 2.62,
            "AU12_r": 1.74,
            "AU14_r": 1.54,
            "AU25_r": 2.69
        }
    },
    "coarse_descriptions_at_peak": {
        "visual_expression": "Cheek raiser (intensity: 1.45), Lid tightener (intensity: 2.78), Upper lip raiser (intensity: 2.62), Lip corner puller (smile) (intensity: 1.74), Dimpler (intensity: 1.54), Lips part (intensity: 2.69)",
        "visual_objective": "The image captures a moment in a hospital setting. At the center of the frame is a young man, dressed in a white lab coat, his face lit up with laughter. He stands against a backdrop of a blue wall adorned with medical equipment and monitors.\n\nTo his left, partially visible, is another individual. This person is clad in a black shirt and appears to be looking at the young man in the lab coat. The precise positioning of these individuals suggests an interaction or conversation taking place.\n\nThe image does not contain any discernible text. The overall scene paints a picture of a light-hearted moment in what might typically be a serious environment, possibly indicating camaraderie or shared humor among the hospital staff.",
        "audio_analysis": "The audio transcript is: '我哪知道啊我也没有这方便的经验'",
        "video_content": ""
    },
    "final_summary": "The facial action unit peak at 2.88s indicates a brief, slight display of anger and contempt, which may seem contradictory but can be explained by the context of the interaction. The presence of these emotions suggests that the young man in the lab coat is likely responding to something said or done by the individual in the black shirt.\n\nThe facial expression clues at overall peak 3.48s reveal a complex emotional state. The cheek raiser (intensity: 1.45) and lip corner puller (smile) (intensity: 1.74) suggest amusement or playfulness, while the lid tightener (intensity: 2.78) and upper lip raiser (intensity: 2.62) indicate a sense of tension or unease. The dimpler (intensity: 1.54) and lips part (intensity: 2.69) suggest a mix of emotions, possibly indicating that the young man is trying to convey a message while also being cautious.\n\nThe visual context provides further insight into the emotional state. The hospital setting and the presence of medical equipment and monitors create an atmosphere of seriousness, which is contrasted by the light-hearted moment captured in the image. This juxtaposition suggests that the interaction between the two individuals is likely a rare moment of levity in a typically serious environment.\n\nThe audio transcript '我哪知道啊我也没有这方便的经验' (I didn't know, I also don't have this convenient experience) adds to the interpretation. The use of the phrase '方便的经验' (convenient experience) implies that the individual in the black shirt is trying to convey a sense of expertise or familiarity with something, which may be perceived as boastful or arrogant by the young man in the lab coat.\n\nTaking all these clues into account, it appears that the young man in the lab coat is responding to a comment made by the individual in the black shirt, possibly with a mix of amusement and annoyance. The facial expressions suggest that he is trying to convey a sense of humor or playfulness while also being slightly irritated. The context of the hospital setting and the juxtaposition of light-heartedness with seriousness create an atmosphere of camaraderie among the staff.\n\nIn conclusion, the core emotional state is likely one of mild irritation or annoyance, possibly accompanied by amusement or playfulness, and the most likely cause is that the individual in the black shirt made a boastful comment about their experience."
}